{
  "version": "v4",
  "week": 3,
  "title": "Week 03 - Past Simple & Stories",
  "week_profile": {
    "phase": "Foundation",
    "cefr_target": "A1+",
    "focus_theme": "Past Simple"
  },
  "days": {
    "Mon": {
      "day_id": "W03_D01",
      "goal": "Talk about yesterday",
      "session_script": [
        {
          "step_id": "W03_D01_S01",
          "type": "input_video",
          "title": "Input: Verbos Regulares -ed",
          "difficulty_level": "A1+",
          "duration_min": 15,
          "content": {
            "instructions": "Mira el video sobre la pronunciaci\u00f3n de -ED /t/ /d/ /id/. Day focus: Mon.",
            "url": "https://www.youtube.com/watch?v=...",
            "offline_ref": "Video_PastED_A1.mp4"
          },
          "gate": {
            "type": "timer_complete",
            "value": 15
          },
          "success_criteria": "Identificar 3 sonidos de ED",
          "evidence_required": "timer"
        },
        {
          "step_id": "W03_D01_S02",
          "type": "textbook_drill",
          "title": "Drill: Pasado Simple Regular",
          "difficulty_level": "A1+",
          "duration_min": 30,
          "content": {
            "instructions": "P\u00e1gina 38, Ejercicios 1-4. Day focus: Mon.",
            "resource_locator": {
              "book": "American English File 1",
              "unit": 5,
              "page": 38,
              "exercise": "1-4"
            }
          },
          "gate": {
            "type": "compound",
            "rules": [
              {
                "type": "self_score",
                "min_value": 80
              },
              {
                "type": "min_words",
                "value": 15
              }
            ]
          },
          "success_criteria": "80% correcto",
          "evidence_required": "log"
        }
      ],
      "retention_loop": [
        "W02_present_continuous"
      ],
      "assessment_event": false
    },
    "Tue": {
      "day_id": "W03_D02",
      "goal": "Consolidacion guiada del objetivo semanal",
      "session_script": [
        {
          "step_id": "W03_D02_S01",
          "type": "textbook_drill",
          "title": "Practica estructurada del objetivo semanal",
          "difficulty_level": "A1",
          "duration_min": 120,
          "content": {
            "instructions": "Practica estructurada del objetivo semanal Day focus: Tue.",
            "url": "https://learnenglish.britishcouncil.org/skills/listening/week-03?day=tue&step=w03_d02_s01&field=url",
            "resource_locator": {
              "book": "American English File 1",
              "unit": 3,
              "page": 17,
              "exercise": "Core consolidation task (set exact page before session)"
            }
          },
          "gate": {
            "type": "timer_complete",
            "value": 120
          },
          "success_criteria": "Consolidacion guiada del objetivo semanal",
          "evidence_required": "timer"
        }
      ],
      "retention_loop": [
        "Tue: recycle 5 key chunks from previous session.",
        "Tue: run 3 self-corrections before closing."
      ],
      "assessment_event": false
    },
    "Wed": {
      "day_id": "W03_D03",
      "goal": "Consolidacion guiada del objetivo semanal",
      "session_script": [
        {
          "step_id": "W03_D03_S01",
          "type": "textbook_drill",
          "title": "Practica estructurada del objetivo semanal",
          "difficulty_level": "A1",
          "duration_min": 120,
          "content": {
            "instructions": "Practica estructurada del objetivo semanal Day focus: Wed.",
            "url": "https://learnenglish.britishcouncil.org/skills/listening/week-03?day=wed&step=w03_d03_s01&field=url",
            "resource_locator": {
              "book": "American English File 1",
              "unit": 3,
              "page": 18,
              "exercise": "Core consolidation task (set exact page before session)"
            }
          },
          "gate": {
            "type": "timer_complete",
            "value": 120
          },
          "success_criteria": "Consolidacion guiada del objetivo semanal",
          "evidence_required": "timer"
        }
      ],
      "retention_loop": [
        "Wed: recycle 5 key chunks from previous session.",
        "Wed: run 3 self-corrections before closing."
      ],
      "assessment_event": false
    },
    "Thu": {
      "day_id": "W03_D04",
      "goal": "Consolidacion guiada del objetivo semanal",
      "session_script": [
        {
          "step_id": "W03_D04_S01",
          "type": "textbook_drill",
          "title": "Practica estructurada del objetivo semanal",
          "difficulty_level": "A1",
          "duration_min": 120,
          "content": {
            "instructions": "Practica estructurada del objetivo semanal Day focus: Thu.",
            "url": "https://learnenglish.britishcouncil.org/skills/listening/week-03?day=thu&step=w03_d04_s01&field=url",
            "resource_locator": {
              "book": "American English File 1",
              "unit": 3,
              "page": 19,
              "exercise": "Core consolidation task (set exact page before session)"
            }
          },
          "gate": {
            "type": "timer_complete",
            "value": 120
          },
          "success_criteria": "Consolidacion guiada del objetivo semanal",
          "evidence_required": "timer"
        }
      ],
      "retention_loop": [
        "Thu: recycle 5 key chunks from previous session.",
        "Thu: run 3 self-corrections before closing."
      ],
      "assessment_event": false
    },
    "Fri": {
      "day_id": "W03_D05",
      "goal": "Consolidacion guiada del objetivo semanal",
      "session_script": [
        {
          "step_id": "W03_D05_S01",
          "type": "textbook_drill",
          "title": "Practica estructurada del objetivo semanal",
          "difficulty_level": "A1",
          "duration_min": 120,
          "content": {
            "instructions": "Practica estructurada del objetivo semanal Day focus: Fri.",
            "url": "https://learnenglish.britishcouncil.org/skills/listening/week-03?day=fri&step=w03_d05_s01&field=url",
            "resource_locator": {
              "book": "American English File 1",
              "unit": 3,
              "page": 20,
              "exercise": "Core consolidation task (set exact page before session)"
            }
          },
          "gate": {
            "type": "timer_complete",
            "value": 120
          },
          "success_criteria": "Consolidacion guiada del objetivo semanal",
          "evidence_required": "timer"
        }
      ],
      "retention_loop": [
        "Fri: recycle 5 key chunks from previous session.",
        "Fri: run 3 self-corrections before closing."
      ],
      "assessment_event": false
    },
    "Sat": {
      "day_id": "W03_D06",
      "goal": "Consolidacion guiada del objetivo semanal",
      "session_script": [
        {
          "step_id": "W03_D06_S01",
          "type": "textbook_drill",
          "title": "Practica estructurada del objetivo semanal",
          "difficulty_level": "A1",
          "duration_min": 120,
          "content": {
            "instructions": "Practica estructurada del objetivo semanal Day focus: Sat.",
            "url": "https://learnenglish.britishcouncil.org/skills/listening/week-03?day=sat&step=w03_d06_s01&field=url",
            "resource_locator": {
              "book": "American English File 1",
              "unit": 3,
              "page": 21,
              "exercise": "Core consolidation task (set exact page before session)"
            }
          },
          "gate": {
            "type": "timer_complete",
            "value": 120
          },
          "success_criteria": "Consolidacion guiada del objetivo semanal",
          "evidence_required": "timer"
        }
      ],
      "retention_loop": [
        "Sat: recycle 5 key chunks from previous session.",
        "Sat: run 3 self-corrections before closing."
      ],
      "assessment_event": false
    },
    "Sun": {
      "day_id": "W03_D07",
      "goal": "Weekly Assessment",
      "session_script": [
        {
          "step_id": "W03_D07_S01",
          "type": "quiz",
          "title": "Weekly Quiz Week 3",
          "difficulty_level": "A1",
          "duration_min": 300,
          "content": {
            "instructions": "Complete quiz Day focus: Sun.",
            "url": "https://learnenglish.britishcouncil.org/skills/listening/week-03?day=sun&step=w03_d07_s01&field=url"
          },
          "gate": {
            "type": "timer_complete",
            "value": 300
          },
          "success_criteria": "Pass",
          "evidence_required": "timer"
        }
      ],
      "retention_loop": [
        "Sun: recycle 5 key chunks from previous session.",
        "Sun: run 3 self-corrections before closing."
      ],
      "assessment_event": false
    }
  }
}
