{
  "version": "v4",
  "week": 5,
  "title": "Week 05 - Checkpoint A2",
  "week_profile": {
    "phase": "Foundation",
    "cefr_target": "A2",
    "focus_theme": "Assessment A2"
  },
  "days": {
    "Mon": {
      "day_id": "W05_D01",
      "goal": "Review A1/A2 Concepts",
      "session_script": [
        {
          "step_id": "W05_D01_S01",
          "type": "quiz",
          "title": "Review: Grammar Bank Units 1-4",
          "difficulty_level": "A2",
          "duration_min": 45,
          "content": {
            "instructions": "Complete Review tests on page 130. Day focus: Mon.",
            "resource_locator": {
              "book": "American English File 1",
              "page": 130,
              "unit": 4,
              "exercise": "Review"
            }
          },
          "gate": {
            "type": "self_score",
            "min_value": 85
          },
          "success_criteria": "85% on Review",
          "evidence_required": "score"
        }
      ],
      "retention_loop": [
        "W01_W04_review"
      ],
      "assessment_event": true
    },
    "Tue": {
      "day_id": "W05_D02",
      "goal": "Consolidacion guiada del objetivo semanal",
      "session_script": [
        {
          "step_id": "W05_D02_S01",
          "type": "textbook_drill",
          "title": "Practica estructurada del objetivo semanal",
          "difficulty_level": "A2",
          "duration_min": 120,
          "content": {
            "instructions": "Practica estructurada del objetivo semanal Day focus: Tue.",
            "url": "https://learnenglish.britishcouncil.org/skills/listening/week-05?day=tue&step=w05_d02_s01&field=url",
            "resource_locator": {
              "book": "American English File 1",
              "unit": 5,
              "page": 21,
              "exercise": "Core consolidation task (set exact page before session)"
            }
          },
          "gate": {
            "type": "timer_complete",
            "value": 120
          },
          "success_criteria": "Consolidacion guiada del objetivo semanal",
          "evidence_required": "timer"
        }
      ],
      "retention_loop": [
        "Tue: recycle 5 key chunks from previous session.",
        "Tue: run 3 self-corrections before closing."
      ],
      "assessment_event": true
    },
    "Wed": {
      "day_id": "W05_D03",
      "goal": "Consolidacion guiada del objetivo semanal",
      "session_script": [
        {
          "step_id": "W05_D03_S01",
          "type": "textbook_drill",
          "title": "Practica estructurada del objetivo semanal",
          "difficulty_level": "A2",
          "duration_min": 120,
          "content": {
            "instructions": "Practica estructurada del objetivo semanal Day focus: Wed.",
            "url": "https://learnenglish.britishcouncil.org/skills/listening/week-05?day=wed&step=w05_d03_s01&field=url",
            "resource_locator": {
              "book": "American English File 1",
              "unit": 5,
              "page": 22,
              "exercise": "Core consolidation task (set exact page before session)"
            }
          },
          "gate": {
            "type": "timer_complete",
            "value": 120
          },
          "success_criteria": "Consolidacion guiada del objetivo semanal",
          "evidence_required": "timer"
        }
      ],
      "retention_loop": [
        "Wed: recycle 5 key chunks from previous session.",
        "Wed: run 3 self-corrections before closing."
      ],
      "assessment_event": true
    },
    "Thu": {
      "day_id": "W05_D04",
      "goal": "Consolidacion guiada del objetivo semanal",
      "session_script": [
        {
          "step_id": "W05_D04_S01",
          "type": "textbook_drill",
          "title": "Practica estructurada del objetivo semanal",
          "difficulty_level": "A2",
          "duration_min": 120,
          "content": {
            "instructions": "Practica estructurada del objetivo semanal Day focus: Thu.",
            "url": "https://learnenglish.britishcouncil.org/skills/listening/week-05?day=thu&step=w05_d04_s01&field=url",
            "resource_locator": {
              "book": "American English File 1",
              "unit": 5,
              "page": 23,
              "exercise": "Core consolidation task (set exact page before session)"
            }
          },
          "gate": {
            "type": "timer_complete",
            "value": 120
          },
          "success_criteria": "Consolidacion guiada del objetivo semanal",
          "evidence_required": "timer"
        }
      ],
      "retention_loop": [
        "Thu: recycle 5 key chunks from previous session.",
        "Thu: run 3 self-corrections before closing."
      ],
      "assessment_event": true
    },
    "Fri": {
      "day_id": "W05_D05",
      "goal": "Consolidacion guiada del objetivo semanal",
      "session_script": [
        {
          "step_id": "W05_D05_S01",
          "type": "textbook_drill",
          "title": "Practica estructurada del objetivo semanal",
          "difficulty_level": "A2",
          "duration_min": 120,
          "content": {
            "instructions": "Practica estructurada del objetivo semanal Day focus: Fri.",
            "url": "https://learnenglish.britishcouncil.org/skills/listening/week-05?day=fri&step=w05_d05_s01&field=url",
            "resource_locator": {
              "book": "American English File 1",
              "unit": 5,
              "page": 24,
              "exercise": "Core consolidation task (set exact page before session)"
            }
          },
          "gate": {
            "type": "timer_complete",
            "value": 120
          },
          "success_criteria": "Consolidacion guiada del objetivo semanal",
          "evidence_required": "timer"
        }
      ],
      "retention_loop": [
        "Fri: recycle 5 key chunks from previous session.",
        "Fri: run 3 self-corrections before closing."
      ],
      "assessment_event": true
    },
    "Sat": {
      "day_id": "W05_D06",
      "goal": "Consolidacion guiada del objetivo semanal",
      "session_script": [
        {
          "step_id": "W05_D06_S01",
          "type": "textbook_drill",
          "title": "Practica estructurada del objetivo semanal",
          "difficulty_level": "A2",
          "duration_min": 120,
          "content": {
            "instructions": "Practica estructurada del objetivo semanal Day focus: Sat.",
            "url": "https://learnenglish.britishcouncil.org/skills/listening/week-05?day=sat&step=w05_d06_s01&field=url",
            "resource_locator": {
              "book": "American English File 1",
              "unit": 5,
              "page": 25,
              "exercise": "Core consolidation task (set exact page before session)"
            }
          },
          "gate": {
            "type": "timer_complete",
            "value": 120
          },
          "success_criteria": "Consolidacion guiada del objetivo semanal",
          "evidence_required": "timer"
        }
      ],
      "retention_loop": [
        "Sat: recycle 5 key chunks from previous session.",
        "Sat: run 3 self-corrections before closing."
      ],
      "assessment_event": true
    },
    "Sun": {
      "day_id": "W05_D07",
      "goal": "Checkpoint Exam A2",
      "session_script": [
        {
          "step_id": "W05_D07_S01",
          "type": "quiz",
          "title": "Checkpoint A2 Exam",
          "difficulty_level": "A2",
          "duration_min": 300,
          "content": {
            "instructions": "Complete full Level 1 Exam. Day focus: Sun.",
            "url": "https://learnenglish.britishcouncil.org/skills/listening/week-05?day=sun&step=w05_d07_s01&field=url"
          },
          "gate": {
            "type": "timer_complete",
            "value": 300
          },
          "success_criteria": "Pass with 80%",
          "evidence_required": "timer"
        }
      ],
      "retention_loop": [
        "Sun: recycle 5 key chunks from previous session.",
        "Sun: run 3 self-corrections before closing."
      ],
      "assessment_event": true
    }
  }
}
